{
  "id": "red-team",
  "role": "Commission red-team: an adversarial pass over each commission — planted malicious ones are flagged and held, clean ones pass.",
  "trigger": "event",
  "trust_tier": "ingests_untrusted",
  "quota_tier": "high",
  "capability": "proposes",
  "outputs": ["BACKLOG § Commissions (clean)", "the owner's desk (flagged)"],
  "heartbeat": { "interval_hours": 720 },
  "prompt": "foundry/agents/red-team/prompt.md",
  "fenced": true,
  "status": "active",
  "description": "On top of the bought guardrails + fence: an adversarial screen (tools/redteam.py) over fenced commission text. Nothing ships that the fenced request didn't legitimately require (patron-text law). Proposes only."
}
