{
  "id": "foundry-loop",
  "role": "The product loop — designs, builds, tests, reviews, and publishes plugins one iteration at a time (LOOP.md).",
  "trigger": "schedule",
  "trust_tier": "trusted",
  "quota_tier": "product",
  "capability": "writes:**",
  "outputs": ["plugins/", "foundry/records/", "state/", "site/", ".claude-plugin/marketplace.json"],
  "heartbeat": { "interval_hours": 24 },
  "workflow": ".github/workflows/run-shift.yml",
  "gates": ["validate", "build", "smoke", "qa"],
  "status": "dormant",
  "description": "Dormant under ADR-032. Model work may run only in a live, attended interactive session; GitHub Actions and headless runners cannot invoke it. Session changes still land through reviewed pull requests and required gates."
}
